,"Apex Technology","Apex is one the nation’s leading single and multi-family construction engineering firms. Based in Jacksonville, FL and serving clients across the U.S., with emphasis in the Southeast, Mid-Atlantic, Mid-West and Southwest, we use state-of-the-art technology to help many of the country’s premiere builders, architects and component manufacturers ensure that their projects’ structural and mechanical systems work together with the building components for optimum performance, efficiency and value.

Our innovative, coordinated approach utilizes Building Information Modeling (BIM) to help minimize waste and maximize value. Working with all internal and external project partners, we look upstream and downstream to understand all the interdependent elements of the engineering design plan – everything from architectural criteria to component manufacturing constraints, budget, scheduling and more.

We then construct virtual Revit models, and using tools like Virtual Reality and 3D, 4D, 5D and 6D modeling, consider how all engineered systems and components will work together. We use this information to make the best decisions, avoiding costly and frustrating inefficiencies before they occur, optimizing engineering to increase efficiency and lower costs while maximizing performance, value and end-user satisfaction..","Civil Engineering","51-200 employees","Privately Held","Jacksonville, Florida","United States","apextechnology.com","https://www.linkedin.com/company/jay-apex-technology",
,"ClarkDietrich Engineering Services LLC","ClarkDietrich Engineering Services LLC is a full service structural engineering company specializing in cold-formed metal stud framing design.  We provide engineered shop drawings, Building Information Modeling (BIM) services, panelized drawings, technical support, product support & Engineer-of-Record services to the construction industry.

Follow our company for special announcements, promotions, and other exclusive information.

Contact us at:
Engineering: 877-832-3206     
Technical Support: 888-437-3244 
http://www.clarkdietrich.com/services/engineering-services

ClarkDietrich Engineering Services LLC is a wholly owned subsidiary of ClarkDietrich Building Systems, is a national manufacturer of construction materials with a focus on providing complete building solutions to the construction marketplace. ClarkWestern Building Systems and Dietrich Metal Framing have consistently set the standard for quality and leadership in the industry and have built the finest reputation as major suppliers of lath and steel framing systems in the United States. ClarkDietrich operates 14 manufacturing facilities; see the following link for locations. http://www.clarkdietrich.com/about/locations","Civil Engineering","51-200 employees","Privately Held","McDonough, GA","United States","clarkdietrich.com","https://www.linkedin.com/company/clarkdietrich-engineering-services-llc",
,"Caruso Turley Scott Structural Engineers","Caruso Turley Scott Structural Engineers is the largest structural engineering team in the southwest.  Our depth of experience and our passion for structural engineering provide our clients with excellence in structural engineering services.  CTS specializes in efficient structural designs of all types of building structures, including large complex projects using BIM three-dimensional modeling.  CTS is licensed to practice in all 50 States, Washington DC, Guam, Puerto Rico and the US Virgin Islands. Our team includes 24 registered structural engineers and LEED AP project managers.
   Sam Caruso founded Caruso Engineering in 1963 on the premise of excellence in structural engineering supported by outstanding customer service.  Sam’s legacy lives on in the CTS culture of progressive design solutions and outstanding client service.  
   Our office has provided structural engineering services on numerous high profile and award winning projects including Marina Heights/State Farm Regional Headquarters, Maricopa County Sheriff's Office new Corporate Headquarters, Chandler City Hall, ASU’s  Walter Cronkite School of Journalism, Apollo Riverpoint Center, Hayden Ferry Development, the Papago Gateway Biotechnology Research Center, Wildhorse Pass Hotel & Casino and the Banner Del Web Memorial Hospital Expansion.
   We thank all of our clients for selecting the CTS team on past projects and look forward to collaborating on many new projects in the years to come.","Civil Engineering","51-200 employees","Privately Held","Tempe, AZ","United States","ctsaz.com","https://www.linkedin.com/company/caruso-turley-scott-inc-",
,"Southern A&E, LLC","Southern A&E, LLC is a full-service architecture and engineering design firm specializing in the design of educational, athletic, industrial, and commercial facilities. Our primary focus at Southern A&E is the complete satisfaction of our clients. We encourage each of our employees to think like a manager, placing the welfare of our clients, the company, and our employee teams at the center of every decision. Every project we design, whether a simple remodel or a complex new facility, benefits from our unique employee-empowered approach. Our project managers and contract administrators further strengthen the client-designer relationship by working closely with each client throughout the project's lifecycle. This collaborative approach makes our clients an integral part of the Southern A&E design team.

At Southern A&E, we have in-house design experts to manage projects from inception to occupancy and beyond. Our in-house disciplines include Architecture, Landscape Architecture, Civil Engineering, Electrical Engineering, Mechanical Engineering, Plumbing Design, Structural Engineering, Interior Design, Food Service Design, and Contract Administration.","Architecture and Planning","51-200 employees","Privately Held","Austell, GA","United States","southernae.com","https://www.linkedin.com/company/southernae-llc",
,"Jones & Henry Engineers","Today, Jones & Henry Engineers, Ltd., continues to provide high quality consulting services in water, wastewater, storm water, and civil engineering to municipalities and industries throughout the Ohio, Indiana and Michigan regions. We have full-service capabilities at all of our offices in Toledo and Cincinnati (OH), Kalamazoo (MI), plus Fort Wayne and Carmel (IN). The staff at Jones & Henry include environmental, civil, electrical, chemical, and mechanical engineers; certified operators of water and wastewater systems; and certified groundwater professional. Engineering technicians, programmers, CAD operators, drafters, field representatives, and administrative and support personnel comprise the remainder of the staff.","Civil Engineering","51-200 employees","Privately Held","Toledo, Ohio","United States","jheng.com","https://www.linkedin.com/company/jones-&-henry-engineers",
,"New Vision Agency","New Vision Agency helps construction teams meet their deadlines and fix problems on the screen with BIM/VDC modeling.

We build projects virtually to detect problems & avoid dealing with them in the field. 

VDC/BIM models aim to decrease excess labor, materials, delays, costs, frustration, confusion, stress, and uncertainty. 

Working on iconic projects for clients like Apple, Meta, Ford, and Google has turned us into true professionals and experts capable of handling large-scale projects.


Ready to deliver projects faster & better?

Reach out to us here or visit our website to get in touch.","Architecture and Planning","51-200 employees","Privately Held","Fort Lauderdale, FL","United States","n-vision.agency","https://www.linkedin.com/company/new-vision-project",
,"ECM Consultants, Inc.","ECM Consultants, Inc. is a minority-owned, full-service engineering, architectural, inspection and construction management firm established in 1995. The firm has provided professional services for over 700 varied projects for local, state, and federal agencies. 

ECM is licensed as an Engineering, Architectural, and Construction Management firm in Louisiana and as an Engineering firm in Mississippi and Alabama. Our affiliated company, ECM Consultants of Texas, LLC is registered in Texas and pre-qualified with TXDOT.

Our staff includes Civil, Structural, Mechanical, Electrical and Water Resources Engineers; Architects; Construction Managers; Construction Quality Assurance Inspectors; Certified Value Specialists; CAD Technicians; and Administrative Support Staff - all with appropriate licensure in multiple states.

ECM’s professional qualifications and experience, combined with integrity, reliability and commitment to providing high quality professional services have earned ECM an excellent reputation among our clients. We have received exceptional performance ratings from our clients and have been rewarded with repeat work.","Civil Engineering","51-200 employees","Privately Held","Suite 200, Louisiana","United States","ecmconsultants.com","https://www.linkedin.com/company/ecm-consultants",
,"Ashley & Vance Engineering, Inc.","Ashley & Vance Engineering provides creative, collaborative and cost-conscious structural and civil engineering solutions. 

Our firm offers expertise in many market sectors providing engineering services for projects in energy, public works, institutional, industrial, agricultural, commercial and residential related projects. Our team provides extensive experience in civil engineering, structural engineering, planning, permitting, construction management, and construction engineering. This allows us to meet the client’s needs so that projects are completed efficiently, safely, and on time.

From its inception in 2005, the company has focused on serving the best interests of the client by utilizing experience in the engineering and construction industry to turn concepts into constructible realities. With decades of combined experience in construction, civil engineering, and structural design, the principals at Ashley & Vance Engineering have developed project teams that have built a reputation for delivering practical and cost effective engineering designs, on time and on budget. Our design philosophy has been shaped by the individual experience of each principal to create a thoughtful, real world approach to construction.

Key words: Seismic evaluation, seismic retrofit, structural analysis, hydraulic modeling, hydrology, piping, water storage, water conveyance, water treatment, water tank, wastewater, septic, stormwater, Low Impact Design, LID, sustainable development, grading plans, site plans, construction management, specifications, ADA Access, ADA path of travel, roadway geometric design, RISA, BIM, Navisworks, Civil 3D, Autodesk, Revit.","Civil Engineering","51-200 employees","Privately Held","San Luis Obispo, California","United States","ashleyvance.com","https://www.linkedin.com/company/ashleyvanceengineering",
,"Unintech Consulting Engineers, Inc.","Founded in 1992, Unintech Consulting Engineers, Inc. is a multi-disciplined engineering consulting and design firm based in San Antonio, Texas and a branch office in Austin. We provide quality structural and civil engineering, and surveying services to a wide variety of public and private sector clients throughout Texas and the United States.

Our diverse team of over 50 personnel is made up of registered professional engineers, graduate engineers, registered professional land surveyor, survey crews, a team of CADD technicians, and a solid foundation of support personnel. UNINTECH offers LEED Accredited experience and is capable of providing designs using Revit. Our engineers are also experienced with Building Information Modeling (BIM) and have a Certified Floodplain Manager on staff. We are pre-certified in 15 TxDOT categoires. 

UNINTECH has consistently been ranked among the Top 25 Largest Engineering and Women-Owned firms in San Antonio by the San Antonio Business Journal. 

UNINTECH is certified as a Small / Minority / Woman-Owned Business Enterprise by the South Central Texas Regional Certification Agency (SCTRCA) and certified as a Historically Underutilized Business (HUB).  UNINTECH is also certified as Minority and Woman-Owned Business Enterprise with the City of Austin. UNINTECH is also self-certified as an 8(m) EDWOSB through the federal government.","Civil Engineering","51-200 employees","Privately Held","San Antonio, TX","United States","unintech.com","https://www.linkedin.com/company/unintech",
,"FOCUS Engineering & Surveying","FOCUS is a full-service civil engineering and surveying firm that specializes in residential and commercial development projects. Established in 2007, we are locally owned and comprised of licensed professional engineers, licensed professional land surveyors, civil design technicians, field land surveyors, and administrative professionals.

FOCUS is committed to providing our clients unmatched customer service. Our philosophy is ""To do all we can to assist our clients in making their projects a total success."" We emphasize a business culture defined by accessibility, communication, and prompt action by all Focus employees in proportion to our clients needs. We will make ""your"" project ""our"" project by taking ownership in the services we provide to help make your project a successful one.","Civil Engineering","51-200 employees","Partnership","Midvale, Utah","United States","focus-es.com","https://www.linkedin.com/company/focus-utah-idaho",
,"MBK Engineers","Located in Sacramento, California, MBK Engineers (formerly Murray, Burns & Kienlen, Consulting Civil Engineers) has provided clients with complete engineering and consulting services in the areas of water rights, flood control, water resource planning, and environmental documentation since 1967. The staff, consisting of professional engineers with registrations in California, Nevada, and Oregon; a registered hydrologist; and a registered land surveyor; are uniquely experienced and qualified to perform analyses and study in hydrology, hydraulics, planning, and operational analysis. 

The professional staff is supported by a variety of resources, including a library comprised of photos, government documents, primary sources and historical materials, maps and drawings developed through research, and firsthand experience of major water resources and flood issues, projects and events in California and other areas. An experienced technical support staff supplies comprehensive CAD, GIS, cartography, presentation graphics, and field services.

In addition, MBK Engineers works closely with specialists in the fields of geotechnical engineering, fisheries and wildlife, soil science, agronomy, economics, history, geography, and law, in order to provide clients with a full range of services related to water resources.","Civil Engineering","51-200 employees","Privately Held","Sacramento, California","United States","mbkengineers.com","https://www.linkedin.com/company/mbk-engineers",
,"KCL Solutions LLC","We have over 15 years of experience in the Architectural Design field. We are 3D Visualization firm having cost effective solutions for your property marketing. We believe in purpose driven creative designs. We involve our clients in every step and offer consultative approach to deliver excellence. We are already engaged with clients based in USA, UAE & other countries. Contact us for more details.

We are ONE STOP SHOP for all your needs - be it 3D needs for Interior, Exterior, Floor Plan, Furniture, Site or Amenities Map, Animation or VR. We can also support you with website development. We can help you with anything.

For any questions, get connected with - 

Darren Daze - darren.daze@kcl-solutions.com","Architecture and Planning","51-200 employees","Privately Held","Jersey, New Jersey","United States","kcl-solutions.com","https://www.linkedin.com/company/kcl-solutions-pvt-ltd",
,"Acute Engineering","Acute Engineering is a structural engineering firm specializing in residential and small commercial construction. Established in 2002, Acute Engineering is one of the premier light frame construction engineering firms in the west. With offices near Brigham Young University, University of Utah, Utah Valley University, and Portland State University, we draw on some of the best and brightest young minds and graduates in the fields of drafting and structural engineering. We have developed tools, programs, and procedures that allow us to provide engineering at a very competitive cost while maintaining quick turnarounds. Whether you are working on a residential home or a commercial project, come see what Acute Engineering can do for you. 

""Acute Engineering is a master of structural design.  They have an engineering system that provides consistent and timely results.  Their passion for engineering excellence is evident in all they do.  Acute Engineering helps me understand and envision the end product, which, as a result, ensures that my projects are not only functional, but exceptionally designed and aesthetically pleasing as well.  They are the most professional and organized engineering firm I've partnered with.""  John Phippen, Architectural Designer","Civil Engineering","51-200 employees","Privately Held","Orem, Utah","United States","acuteengineering.com","https://www.linkedin.com/company/acute-engineering",
,"Technyx Euro Services","Technyx markets outsourcing services in the detailing and Building Information Modeling (BIM) support sectors from its offices in St. Georges and Boucherville (Canada), Brasov (Romania), Kolkata (India) and Hong Kong.
In January, Technyx acquired the assets of InteliBuild Limited in Hong Kong. InteliBuild offers consulting services to clients on construction projects that use BIM and 3D digital models.","Civil Engineering","201-500 employees","Privately Held",,"United States","technyx.ws","https://www.linkedin.com/company/technyx-euro-services",
,"Rosehill Gardens","Rosehill Gardens now is offering Land Planning / Landscape Architecture and associated services. 
Our new mantra is simply:  DESIGN * BUILD * MAINTAIN.  At Rosehill Gardens, we have the best and most diverse locally grown plant materials to offer in the Midwestern United States.  Our nurseries total over 1,000 acres and we have in excess of 100,000 trees to choose from for upcoming construction projects.  All plant materials come with a 2 year standard guarantee (unless specified otherwise or negotiated).  

Now that Rosehill Gardens is offering Landscape Architecture and Environmental Design, we look forward to 
being the recognized leaders in Kansas City for Design Build and Landscape Architectural Services.
The Design / Build approach can greatly reduce budget problems.  In addition, quality is controlled and preserved all the way through the design process through until installation of the project.  

Rosehill Gardens Landscape Architecture's capabilities include:
Design – Build Services and Budgeting
City ordinance review and coordination 
LEED Projects of all types
BMP Design (Rain Gardens, Bio cells, swales, channels, etc.)
Full site CAD Design and / or production capabilities
Commercial and Residential Site Design
Hardscape Design
Landscape Design
Irrigation Design
Specifications

Let Rosehill Gardens help build your next project from start to finish.","Architecture and Planning","51-200 employees","Privately Held","kansas city, Missouri","United States","rosehillgardens.com","https://www.linkedin.com/company/rosehill-gardens",
,"Rowland Design","As of November 2021, Rowland Design, Indiana’s 2019 AIA Design Firm of the year with 50-year legacy of architecture and interior design announced it has merged with Luminaut, a vibrant creative studio based in Cincinnati with nationally recognized expertise in hospitality and senior living. This brings together two creative forces in architecture and interior design with a shared devotion to crafting solutions that illuminate and inspire.

“Today marks the beginning of an exciting new chapter, one where we will be able to forge connections between our neighboring communities of Cincinnati and Indianapolis. We’re pleased to be merging our company with one which shares our values and which will allow us to expand our business and do even more and better work for our clients” said President Jill Rose, “and continue to reignite the spark our com 
Our services include architectural renovation and new construction, interior design, schedule and budget development, construction administration, space planning, building programming, furniture and finish selection, move coordination, and historic preservation. We also provide signage and way finding design, art programming, lighting design, facilities assessments, and more.
 
We are designers and architects certified by the US National Green Building Council, the American Institute of Architects, the International Interior Design Association, the American Society of Interior Designers, the Society for Environmental Graphic Designers, the National Council for Interior Design Qualification, and several other national organizations.

Founded in 1968 by trailblazing designer Sallie Rowland, our team has joined forces with Luminaut, a vibrant design studio in Cincinnati, OH. This brings together two creative forces in architecture and interior design with a devotion to crafting solutions that illuminate and inspire. Together, as Luminaut, we are positioned to shine brighter than ever.","Architecture and Planning","51-200 employees","Privately Held","Indianapolis, IN","United States","luminaut.com","https://www.linkedin.com/company/luminautrowland","People Search Updated"
,"Ezra Lee Design+Build","INTENTIONALLY UNCONVENTIONAL - Ezra Lee Design+Build is an awarded, innovative, full-service design and build firm, that offers Architecture, Construction, Interior Design, and Furniture + Decor. 

Every project is approached thoughtfully and collaboratively to deliver a product that reflects the client's lifestyle. Our unique design-build process allows our team to pursue excellence as we eliminate the disconnect between the client, designer, and builder to create a seamless experience. 

Because we understand the building process can be frustrating, our business philosophy is centered around providing an incredible experience that is unparalleled and second to none in the industry. 

By utilizing the latest technology and communication tools, we will work closely with you to deliver your final product on time, on budget, and exactly how you want it while leading you effortlessly through the process.

With over a dozen years of EZD+B being in business, we have been awarded the following in Utah home shows:

13x Awards - Utah Valley Parade of Homes

3x Awards - Salt Lake Parade of Homes

2x People's Choice Award - Park City Showcase of Homes

We are designers. We are builders. We are Artists.

We are Ezra Lee Design+Build.

 

Follow our other social media accounts:

 

Instagram - @ezraleedesignbuild

Facebook - @ezraleedesignbuild

Houzz - @ezraleedesignbuild","Architecture and Planning","51-200 employees","Privately Held","Alpine, Utah","United States","ezralee.com","https://www.linkedin.com/company/ezra-lee-design-build","People Search Updated"
,"MEC International LLC","MEC International, LLC is a Management and Civil Engineering Certified Small Business, We are Certified by:

- DBE Federal Government 
- HUBZone Small Business Administration (SBA) 
- SBE State of California Department of General Services (DGS SBE #1784190)
- MBE California Public Utilities Commission (CPUC # 17001045)
- SMUD Small Business Program SEED 
- CalTrans MBE

MEC International, LLC is a highly specialized consultant on Civil Engineering and Management projects. Our experience spans the full project life-cycle, from inception and pre-feasibility, to materials testing and characterization, to advanced engineering modeling, design, production of plans and construction drawings, through decommissioning, closure and reclamation. Our Engineering Consulting Group’s mission is: “To provide state of the art testing, modeling, and engineering services to our clients”.

Our company’s structure allows us an extensive network of experts specializing in all areas of Civil Engineering, Mechanical and Electrical, CAD drafting and plans and specs, testing, modeling, construction support, permitting, stormwater, SWPPP, water & wastewater, air quality, environmental reclamation, closure, and many other fields.","Civil Engineering","51-200 employees","Privately Held","San Francisco, CA","United States","mecinternational.us","https://www.linkedin.com/company/mec-consulting","People Search Updated"
,"Steel Design Solution","Steel Design Solution specializes in steel detailing services and accommodates the needs and requirements of fabricators in the steel industry. We provide Structural Steel Detailing and Miscellaneous Steel Detailing all over the world. We follow client standards to maintain the guidelines set by the AISC, IBC, SJI, SDI, NISD, ADA, ANSI, ASTM, AWS, SSPC, AGA, SEAA, NAAMM, and OSHA, CISC, BS, EC, IS  etc.
Send us your drawings and let us do the rest.","Civil Engineering","51-200 employees","Partnership","New mexico","United States","steeldesignsolution.com","https://www.linkedin.com/company/steel-design-solution","People Search Updated"
