,"SCG Design Solutions","SCG Design Solutions Pvt Ltd, a Delaware-based company, is a Structural & Architectural Engineering Service Firm specialized in providing Structural Design, BIM (Building Information Modelling) & Consulting Services to various Architects, Engineers & Contractors throughout the United States.
We have a diversified portfolio, including residential structures, low-rise commercial development & Industrial projects with a complete array of construction materials - steel, cast-in-place concrete, pre-cast concrete, masonry, and wood. With the help of the advanced technology of STAAD/ RAM, Enercalc, SAFE, RISA, REVIT, and AutoCAD., we help our client’s with accurately scaled, computer-generated & object-based models of structures, along with a perfect combination of Architectural & MEP models for a smooth collaboration of design principles.
SCG aims to transform the Client’s Vision into Reality by delivering a creative, efficient & precise structural design and analysis with a touch of elegance in each project. Our professional expertise does NOT believe in “one solution for all” and thus follows a customized client-centric approach, with a thorough technical & practical knowledge of engineering principles, facilitating responsive, economical, and constructible solutions.
Being one of the leading companies, SCG design Solutions is a trusted brand to work with for an integrated and unique solution specially designed for our clients, thus – “You Dream It, We Will Design It!”","Civil Engineering","201-500 employees","Privately Held","Dover, Delaware","United States","scgdesignsolution.com","https://www.linkedin.com/company/scgdesignsolutions",
,"Link Outsourcing","Link Outsourcing synergizes our knowledge and expertise in the industry with our ability to execute to assist our customers in completing their roofing projects faster, with higher quality and at a lower cost through architectural, preconstruction, and back-office solutions. 

Our company delivers unique services for roofing contractors and manufacturers, such as estimating, project optimization and value engineering, preparation of submittal packages and closeout documents, CAD drawing and drafting, and project management and customized services. 

Companies that use Link Outsourcing’s solutions benefit by: 

• Increasing the productivity of their project managers and superintendents by not distracting them with office-related activities. 
• Enhancing the quality of the architectural and preconstruction work while lowering costs and speeding processing time. 
• Expanding the capacity to do additional projects.
• Adding flexibility to scale up and down to adapt overhead to backlog fluctuations.","Architecture and Planning","51-200 employees","Privately Held","San José","United States","linkoutsourcing.com","https://www.linkedin.com/company/link-outsourcing",
,"Novus Architects, Inc.","Available job listings can be found here, https://bit.ly/2P0Yvns

Novus Architects took shape in 1992 – with one architect working for one new client. Strong, long-term relationships are the heart of what we do, and we never take for granted the trust clients place in us to listen intently to their needs, craft a custom process, gather a team with the right skills and passions – and together, bring to life spaces that serve people. 

Every day, we take our diverse interests and collective experiences and put them to work in wholly new ways – again and again. Because while we may carry the title of architect, planner, or designer, we see ourselves as consultants with an architectural perspective. The truth is, we do our best work when we challenge the notions of what an architect, designer, or planner can or should do and step beyond traditional roles to create new, unique processes that bring simplicity and clarity to the most complex projects.  

To build highly functional, beautiful spaces: medical facilities that nurture both physician and family, schools that inspire and engage both children and teacher, community centers that invite both dialogue and worship, is to constantly study how people move in and through spaces, how design influences human interaction, discovery, and deep connection.  

For us, that lifelong study is, like people themselves, always new, always challenging, and ever changing. So we focus on process, priorities, details, and communication. We embrace ingenuity, collaboration, and adaptation, because for us, a space is more than any hospital, school, or house of worship, it’s an always-new way of connecting and serving people.  

Novus Architects 
always new","Architecture and Planning","51-200 employees","Privately Held","Charleston, South Carolina","United States","novusarchitects.com","https://www.linkedin.com/company/novus-architects-inc-",
,"Lochsa Engineering","Boise, Idaho office: Structural Engineering/BIM Services 
Las Vegas, Nevada office: Civil/Structural/BIM/Survey/Traffic/Hydrology

Founded in 1995, Lochsa Engineering is a premier engineering firm offering structural, civil, and traffic engineering services was well as surveying services to an array of clients. We serve as trusted advisers to clients around the world and navigate towards technically challenging engineering projects while focusing on delivering creative and effective design results. Our firm has the experience and expertise to develop advanced and often pioneering solutions for a variety of construction types. 

Our dedication to cultivating new relationships, building cohesive design teams, and delivering operative project solutions has earned us the reputation for excellence from a variety of clients in the private and public sectors, governmental agencies, architectural firms, and building contractors. We look forward to making your concept a reality.","Civil Engineering","51-200 employees","Privately Held","Various Locations, Multiple Offices","Mexico","lochsa.com","https://www.linkedin.com/company/lochsa-engineering",
,"method studio","Method Studio is a full-service architectural and design firm in downtown Salt Lake City.  Several leaders with outstanding experience and credentials have joined our team to focus on creative design solutions, that express our clients vision and solve their specific objectives.

We bring a breadth of experience in both large and small scale projects throughout the region and the United States. Our leadership includes award-winning licensed architects, seasoned architectural and interior designers also bringing recognition nationally for their work, CAD drafters, planners, graphic designers, cost estimators and several intern architects.

Many of our professionals are LEED Accredited and our projects are designed with a mindset toward sustainability.  Many of our projects are designed to LEED Silver and above.  Our breadth of work includes higher education, civic, corporate, mixed-use, cultural and simply working with clients who share our collaborative vision that good design matters.

We approach our work as a collaboration between client and designer, working together to create meaningful places with a lasting impact. In the end, we believe design is about process … A way of doing our work in a systematic way … Our method. Together, we will find opportunities and solve challenges while maintaining the critical aspects of budget, schedule and quality.","Architecture and Planning","51-200 employees","Public Company","Salt Lake City, Utah","United States","method-studio.com","https://www.linkedin.com/company/method-studio",
,"Marnell Companies","We at Marnell Companies have a passion for designing and creating buildings that stand apart, that catch the eye and stir the imagination. It has long been our goal to provide our clients with valued products - projects that are innovative, on time and on budget. Our continued success lies within well planned diversification wrapped into one company. The company has the depth and experience to make the clients dream transform into reality, directing each step necessary to complete the process. Marnell Companies has the ability to handle the responsibilities of the architect, developer, interior designer, construction supervisor and property manager.

We are committed to expanding both our talent as well as our capabilities to provide the highest quality work in each and every project we bring to life. In the pursuit of excellence our expertise continues to broaden in the arenas of hospitality, entertainment, commercial, retail, office, industrial, and other multi-use facilities. The art of the Master Builder is very much alive and flourishing here at Marnell Companies.","Architecture and Planning","51-200 employees","Privately Held","Las Vegas, Nevada","United States","marnellcompanies.com","https://www.linkedin.com/company/marnell-companies",
,"Gall Zeidler Consultants","This year marks 25 years of engineering excellence at Gall Zeidler Consultants (GZ)—a global leader in tunnel design, engineering, geotechnics, tunnel rehabilitation, and program and construction management. With over 300 miles of tunneling projects completed worldwide, our international team specialize in mastering difficult ground conditions by utilizing various methods, including dewatering, grouting and ground freezing. We also specialize in tunneling under shallow overburden and protection of neighboring structures by innovatively combining conventional (NATM/SCL/SEM) and mechanical (TBM) tunneling methods with ground improvement and state of the art waterproofing techniques.

Our service portfolio ranges from conceptual and initial inception-level tasks—such as preparation of feasibility studies through development of tunnel designs and contractual documents—to construction management and site support services. 

With a diverse portfolio of projects in the Rail & Transit, Transportation, Power, Water & Wastewater and Mining markets, we have built a reputation for helping clients overcome complex challenges and advancing world-class infrastructure. As a result of our extensive experience, our specialists are often selected to serve on expert review panels shaping the future of tunneling worldwide.

At GZ, design does not stop at the drawing board—we remain engaged through construction support, ensuring the final product is successfully brought to life.","Civil Engineering","51-200 employees","Privately Held","Ashburn, Virginia","United States","gzconsultants.com","https://www.linkedin.com/company/gall-zeidler-consultants-llc",
,"PCS Structural Solutions","PCS Structural Solutions is the largest single-discipline structural engineering firm in the Northwest. With offices in Seattle, WA, Tacoma, WA, and Portland, OR, we engineer every type of vertical building. Our passion energizes teaming, design, and value across the A/E/C/Owner team. We  engineer over a billion dollars’ worth of construction annually, contributing our deep resources in education, health care, commercial, civic and residential projects.

Through five generations of leadership, PCS has set the course of structural engineering, creating evolutions in project delivery, construction methods, and performance standards that improve resilience. Our team has pioneered BIM integration, VDC utilization, integrated delivery and the alignment of structural steel analysis/detailing/bidding. From our Pacific Northwest base, we serve a national role in writing codes and advancing professional standards. In all, offering new levels of excellence and the forefront of structural solutions.","Civil Engineering","51-200 employees","Privately Held","Tacoma, WA","United States","pcs-structural.com","https://www.linkedin.com/company/pcs-structural-solutions-",
,"CollinsWoerman","We believe that great design drives extraordinary value.

For creative thinkers and industry leaders who want original, inspired design and ideas, CollinsWoerman is a collaborative architecture, interiors, planning, and sustainability firm that provides integrated, sustainable solutions. We challenge conventional thinking by creating inspiring, progressive work that results in innovative outcomes that exceed our clients’ goals. 

Founded in 1988, our staff of 76 consists of architects, planners, interior designers, entitlement specialists, sustainability experts, CAD specialists and LEED accredited professionals. 

Planning and designing about $1 billion a year, CollinsWoerman brings insight and value to the land development process. We are highly successful at adding economic and community value to the public and private domain. 

We plan and design for a wide variety of project types, including healthcare, mixed-use, commercial and retail developments, sustainable communities, science and technology facilities and corporate interiors.

Connect with us at:
facebook.com/collinswoerman
twitter.com/collinswoerman
instagram.com/collinswoerman","Architecture and Planning","51-200 employees","Partnership","Seattle, WA","United States","collinswoerman.com","https://www.linkedin.com/company/collinswoerman",
,"Proficient Engineering","Proficient is a full-service mechanical, electrical, & plumbing engineering design firm with a diverse portfolio of commercial projects that includes offices, retail, multi-family, community, industrial, hospitality, senior living, restaurants, medical, and mixed-use. The firm is licensed across the U.S. and has locations in Atlanta, Knoxville, Denver, and Dallas.

 
At Proficient, we specialize in comprehensive low voltage design solutions to meet the modern needs of businesses and facilities. Our expertise spans telecommunications, video surveillance, and access control, delivering reliable, integrated systems that enhance safety, communication, and efficiency. With a focus on quality and innovation, we work closely with clients to create customized solutions that fit seamlessly into their infrastructure, providing robust, scalable, and secure low voltage installations. Trust Proficient to connect and protect your environment with cutting-edge technology and personalized service.
 
Our BIM team can provide coordination to the Sub Contractor and GC side of Pre-Construction services to verify and validate an MEP design. We also can assist with As-Built services, through use of Laser scanning - offering Scan to BIM as a deliverable.","Architecture and Planning","51-200 employees","Privately Held","Peachtree Corners, GA","United States","proficientengineering.com","https://www.linkedin.com/company/proficient-engineering-inc-",
,"Century West Engineering","Century West Engineering Corporation (Century West) was founded in Bend, Oregon in 1969 and has been providing responsive, quality engineering services to Pacific Northwest clients ever since. Our focus on public work manifested early in our company’s history and now nearly all our revenue comes from cities, counties, ports, and other public agencies.

We are an employee-owned company composed of licensed civil engineers, airport planners, CAD drafters, construction inspectors, accounting professionals, marketers, and administrative specialists. Our commitment to enhancing the communities we serve leads us to work with clients and staff who share our values of providing caring, creative, and collaborative public infrastructure design solutions.","Civil Engineering","51-200 employees","Privately Held","Lake Oswego, Oregon","United States","centurywest.com","https://www.linkedin.com/company/century-west-engineering-corporation",
,"Walpole Outdoors","Since 1933, Walpole Outdoors has been the standard for handcrafted outdoor products, answering the needs of homeowners and professionals alike. The same meticulous attention to detail and timeless good looks is evident in the company’s fences, gates, arbors, pergolas, gazebos, outdoor furniture, and more.

Today, Walpole maintains its position as the preeminent outdoor products company through a commitment to exceeding customer expectations with new techniques and technologies to ensure that the end result satisfies the most discerning clients.

The engineering department at Walpole is the most advanced in the industry. Every order is reviewed by these professionals for manufacturing accuracy. In more technical custom work, engineers use high-tech CAD systems to produce detailed drawings. Customers then have an exact representation of how their project will look when installed.

In addition, many Walpole products are offered in wood alternative modern cellular PVC. This long-lasting, low maintenance material has the look and feel of natural wood, yet won’t rot, split, or warp. Walpole is the largest fabricator of modern cellular PVC in the country.

Walpole also offers a free project consultation. A design representative will visit the customer’s property, suggest styles that are in keeping with the home’s architecture and surroundings, and take necessary measurements.","Architecture and Planning","201-500 employees","Privately Held","Foxborough (Foxboro), Massachusetts","United States","walpoleoutdoors.com","https://www.linkedin.com/company/walpoleoutdoors",
,"Charlan Brock Architects","Charlan Brock Architects (CBA) is driven by the singular goal of Impacting Lives Together. CBA strives for excellence by assisting clients in fulfilling their vision through a collaborative, empowering environment. Established in 1980, the Florida-based full-service architectural firm specializes in all forms of multi-family residential, student housing, and mixed-use developments. 

Over the past four decades, CBA has developed a laser sharp focus on meeting the ever-changing needs of the development industry with attention to all markets, pricing and intensities in the housing sector. Due to their passion and integrity, CBA has proudly become the go-to firm for incorporating housing of all types into mixed-use and town centers throughout the nation. In addition, CBA also concentrates on assisting both private and municipal clients as they determine how to arrange a multitude of uses into cohesive, vibrant, successful communities or design solutions.

Through each and every project, CBA has the same overall goals: to nurture and maintain a clear project vision, to maximize the effectiveness of every team member, and facilitate access to technical expertise and creativity. As a result, CBA has created a highly collaborative process flow, forming close relationships with their clients as well as outside consultants, before and during construction. The majority of CBA's design and construction document work is performed in REVIT, which provides a much more comprehensive design documentation and allows everyone on the team to understand the solution through three-dimensional modeling.","Architecture and Planning","51-200 employees","Privately Held","Maitland, Florida","United States",,"https://www.linkedin.com/company/cbaarchitects",
,"Quattrocchi Kwok Architects (QKA)","Quattrocchi Kwok Architects (QKA) provides comprehensive master planning, design and construction administration services for Northern California K-12 and higher education, historic renovation and community facilities. With more than $2.5 billion in projects completed in the company’s 35+ year history, QKA’s award-winning portfolio reflects a commitment to design that emphasizes environmental sustainability and community impact. QKA has been recognized as one of the nation’s top K-12 and BIM architecture firms by Building Design + Construction. A proven inspiring and collegial environment, the firm has also continually landed on the North Bay Business Journal’s “Best Places to Work” list.","Architecture and Planning","51-200 employees","Privately Held","Santa Rosa, CA","United States","qka.com","https://www.linkedin.com/company/quattrocchi-kwok-architects",
,"19six Architects","Founded in 1906, ours is one of the oldest and most established architectural firms in California. 19six Architecture, formerly known as PMSM Architecture, first entered the architecture industry over a century ago when A.B. Higginson, an architect and designer in his own right, saw major flaws in the design and structure of local buildings and wanted to improve their quality. What began as a local business in Santa Barbara has since grown into an architecture firm known across California for their award-winning design excellence and commitment to community impact.

Our work includes K-12 and Higher Education, Healthcare, Performing Arts, Civic, and Master Planning, as well as architectural and planning services. For over a century, we have served as an extension of our clients, working with them to design dozens of buildings to foster communities and growth.

ARCHITECTURAL SERVICES                                                          
- Programming Development and Site Planning Assessments
- Architectural Building Design                                                                         
- Agency Approvals 
- Project Management			             
- Building Renovation and Rehabilitation               
- Construction Documents / Specifications                                         
- Bid Preparation                                                          
- Construction Administration   
- LEED Certification Processing                                                      
- DSA Closeout 
- Jurisdictional Approval Processing
- Signage and Wayfinding

PLANNING SERVICES  
- Facilities Master Planning and Needs
-  Education Specifications
- Coordination with State Funding Sources
- Phasing and Scheduling
- Program Management
- Sustainability Studies
- Feasibility Studies
- Accessibility Studies","Architecture and Planning","201-500 employees","Privately Held","California","United States","19six.com","https://www.linkedin.com/company/19six",
,"Nova","Nova's story started in 2007. We have 3 offices with experienced Architects and Engineers in all main disciplines. Since 2007 we have delivered thousands of projects to our clients and partners worldwide.

Our experience includes BIM modeling and designing tall buildings in partnership with several large industry partners.","Architecture and Planning","51-200 employees","Partnership","New York, New York","United States","novaae.com","https://www.linkedin.com/company/novaaecomnyc",
,"VCA Structural","Offices in Orange, Oakland and Denver. For more than 30 years, the engineers at VCA have combined expertise with a passion for construction to serve as a trusted advisor for architects, developers and contractors who turn to VCA to deliver competitive, build-able and timely structural engineering solutions. VCA also offers green consulting through it's affiliate company VCA Green.

VCA Sturctural is uniquely focused on projects ranging from single-family developments to large and complex mixed-use buildings. The team maintains an unparalleled record of  “wrap” and “podium” projects, Type III Modified, and parking structure design and offers vast experience with hotels/motels, senior and affordable housing, TOD and commercial structures.

VCA invests heavily in technology and is a leader in wood-frame 3-D and REVIT capability. The team is comprised of innovators dedicated to maximizing each project. When it comes to quality structural engineering, count on VCA Structural. Passionate People. Proven Results.

Orange + Oakland","Civil Engineering","51-200 employees","Privately Held","Orange, CA","United States","vcastructural.com","https://www.linkedin.com/company/vca-structural",
,"Richard L. Bowen + Associates","Since 1959, Bowen has provided exceptional integrated architecture, planning, engineering, and construction management services. Bowen built its reputation through integrity, innovation, and a commitment to our communities. As an employee-owned company, we believe our dedication, our exemplary service, and the relationships we build are the keys to successful, innovative projects.","Architecture and Planning","51-200 employees","Privately Held","Cleveland, Ohio","United States","rlba.com","https://www.linkedin.com/company/bowenaec",
,"SCG Design Solutions","At SCG Design Solutions, we are dedicated to being the leading experts in the field, with an unwavering focus on delivering top-quality Building Information Modelling (BIM) and Structural Engineering Solutions to the Architecture, Engineering & Construction (AEC) firms in the USA. Our commitment to excellence, efficiency, and cost-effectiveness sets us apart as the preferred choice for clients seeking unparalleled results.","Civil Engineering","51-200 employees","Privately Held","Dover, Delaware","United States","scgdesignsolutions.com","https://www.linkedin.com/company/scg-design-solutions",
