,"We R Survey","Experience the pinnacle of surveying solutions with our comprehensive services designed to cater to all your needs. From precise As-Built Surveys to cutting-edge Virtual Reality Surveys, we offer a diverse range of offerings that go beyond the ordinary. Our CAD Services and REVIT Services provide unparalleled accuracy and efficiency, empowering your projects to reach new heights. Explore a world of possibilities as we bring your visions to life with top-notch expertise and innovation.","Architecture and Planning","51-200 employees","Public Company","Carrollwood Village, Florida","United States","wersurvey.com","https://www.linkedin.com/company/wersurvey","People Search Updated"
,"TopBIM Company: BIM & 3D Laser Scanning Services","TopBIM company is dedicated to delivering tailored to your vision Building Information Modeling (BIM) and 3D laser scanning services.

Our services are intended to optimize construction investment for AEC firms, manufacturing companies, and building contractors.

We offer services for various building typologies with Levels of Detailranging from LOD 100 to LOD 500. Also, we plan out your requirements in a suitable BIM dimension range.

Our comprehensive service suite includes BIM Services, Scan To BIM, BIM dimensional modeling, MEPF design and analysis services, Structural analysis Services, BIM Content Creation, BIM Coordination and Clash Detection, Shop Drawings, VDC Services, GIS Services, Digital Twinning, As-Built documentation, Facility management.

With 16+ years of experience and 2500+ projects with some of the best AEC brands, we leverage the latest BIM automation trend for sustainable construction objectives. Our company has vast expertise and experience in delivering result-oriented and data-driven BIM solutions to our clients. If you have questions, feel free to contact us.","Architecture and Planning","201-500 employees","Privately Held","Redmond, WA","United States","topbimcompany.com","https://www.linkedin.com/company/topbim-3d-laser-scanning-company","People Search Updated"
,"Jensen Design & Survey, Inc. (A Sanbell Company)","Jensen Design & Survey, Inc. (JDS), a Sanbell company, is a full-service civil engineering, water resources, surveying, planning, and construction administration firm rooted in Ventura County since 1989. At JDS, we have built a reputation as one of the leading engineers in Ventura County serving some of the County’s largest municipal governments implementing cutting-edge infrastructure, private sector businesses, and global standouts in agricultural. Our clients choose us for reputation, stick with us for dependability, and refer others to us because we are tried and true in getting the job done.

With our multi-disciplined firm located under one roof, we are able to provide our clients seamless project development. We house twelve licensed professional civil engineers, two licensed land surveyors, a registered geologist, and two certified land planners. A complete CAD department of experienced engineering technicians, planning staff, and field surveyors support these professionals. 

As efficiency and quality is a priority for our products, we believe the same is best applied to our company size and staff. Our company thrives because of our company DNA: highly motivated expert staff with a vested interest in our communities. We treat our clients and manage their projects with professionalism and responsiveness, and in return, we have developed a loyal client base. Over the years, our staff has earned the trust of our clients as shown in long-term relationships and consistent new referrals.","Civil Engineering","201-500 employees","Public Company","Billings, Montana","United States","jdscivil.com","https://www.linkedin.com/company/jensen-design-&-survey-inc.","People Search Updated"
,"McGill Engineering, Inc.","MEi has offers state-of-the-art engineering and detailing services to our customers. We have grown our services to match the demand of the steel industry. Want to join us? We are hiring! Please visit our website below.","Civil Engineering","201-500 employees","Privately Held","Tampa, Florida","United States","mei-group.com","https://www.linkedin.com/company/mcgillengineering","People Search Updated"
,"Rice Associates, Inc.","Rice Associates is a survey, photogrammetry and subsurface utility engineering firm that was founded in 1986. The firm is headquartered in Manassas, Virginia and maintains branch offices in Richmond and Virginia Beach, Virginia. Rice Associates has a full-time staff of licensed surveyors, certified photogrammetrists, and multiple field and office technicians that possess a high level understanding of project requirements from project planning through project delivery.

Rice Associates performs over 200 significant survey projects on an annual basis with over 90 percent of this work performed within the Commonwealth of Virginia. Services include control surveys, aerial mapping, LiDAR, photogrammetry, subsurface utility engineering, hydrographic studies, location surveys, bridge situations, closed surveys and global positioning. Project types range from rural roadways to interstate highways and bridge structures.","Civil Engineering","51-200 employees","Privately Held","Manassas, VA","United States","ricesurveys.com","https://www.linkedin.com/company/rice-associates-inc-","People Search Updated"
,"Clark Land Services","Clark Land Services (Clark) is a National Survey Coordinating firm.  We partner with clients across the country to facilitate land surveys in any state.  Our projects include Engineering Design Surveys, ALTA/NSPS Land Title Surveys and Cell Tower Surveys.  Our unique model provides reliable, consistent, nation-wide consulting services for surveys anywhere in the US.  We accomplish this by establishing a single point of contact no matter where the surveys are located. With Clark, our clients receive a high-quality survey that with consistent deliverables on time.

The Game Changer: Project management app: ClarkHUB.  The ClarkHUB is a real-time, proprietary project management tool for our clients.  You can see the progress of your project in real-time, upload and download files and communicate with your Clark Project Manager from anywhere.  

The Clark Business model:  We provide:
•	Clients with a responsive and experienced project manager
•	Fully-vetted network of professional land surveyors
•	CAD drawings consistent across all survey projects, regardless of region
•	High quality projects delivered on-time, within budget and without surprises

Services Include:
ALTA/NSPS Land Title Surveys
•	Due Diligence and Title review
•	Boundary
•	ALTA/NSPS Table A Specifications

Engineering Design Surveys:
•	Topographic Mapping (executed to national mapping standards)
•	Boundary Surveys
•	Subsurface Utility Designating and Locating
•	Legal descriptions and exhibits
•	UAV/Drone Mapping

Telecommunication Surveys
•	FAA 1A and 2C Letters
•	Raw Land Surveys
•	As-Built and Rooftop Surveys
•	Easements and access","Civil Engineering","51-200 employees","Privately Held","Pueblo West, Colorado","United States","clarkls.com","https://www.linkedin.com/company/clark-land-services","People Search Updated"
,"Artco Group Store Fixtures.","Artco Group manufactures custom woodwork and store fixtures. Based in Miami, Florida, for over 30 years Artco Group has a staff of more than 100 professionals operating from a 100,000-square-foot facility. Our company is made up of experts from a variety of backgrounds, including a skilled team of interior designers, architects, project managers, CAD operators, engineers, craftsmen, artisans, and installers; each with a tremendous understanding of the latest technology, which enables us to provide cost-effective workmanship at extremely high standards.

As our business expands both domestically and internationally, we are more committed than ever to delivering superior design and high-quality manufacturing.","Architecture and Planning","51-200 employees","Privately Held","Miami, FL","United States","artcogroup.com","https://www.linkedin.com/company/artco-group","People Search Updated"
,"United Engineers, Inc.","United Engineers Inc. (UEI) is a Houston-based, full service consulting civil engineering and surveying firm providing services in the Houston and surrounding areas.

At UEI, we are proud to have developed long-term relationships with our clients as a result of the commitment and dedication to our primary mission – setting the standard for client satisfaction. In order to accomplish our mission, we maintain a highly qualified staff of professional engineers, design engineers, utility engineers, construction and project managers, surveyors, CAD operators, engineering/surveying technicians, certified construction inspectors and administrators who focus on achieving results and are committed to setting the standard for client expectations. United Engineers guarantees professional-grade quality and total satisfaction for every service we provide, because that's how engineering should be. 


TBPE Firm Registration No. F-142
TRPLS Firm Registration No. 10117800","Civil Engineering","51-200 employees","Privately Held","Houston, Texas","United States","unitede.com","https://www.linkedin.com/company/unitede","People Search Updated"
,"Basort","En Basort hemos creado el despacho BIM mas grande del estado. Somos una firma de ingeniería que concentra sus esfuerzos en el diseño y construcción en las áreas de arquitectura e ingeniería, teniendo como compromiso la constante innovación por medio del uso de tecnologías especializadas, con el fin de generar información sustancial que de forma homologada representa la visión de un proyecto concreto, superando así las expectativas de nuestros clientes y contratistas.","Civil Engineering","51-200 employees","Privately Held","Santiago de Queretaro, Queretao","Mexico","basort.com","https://www.linkedin.com/company/basort","People Search Updated"
,"BluEntCAD","BluEntCAD has been serving the AEC industry since 2003. Our client-centric approach has helped us maintain long-term professional relationships. 
Today, our company has branched into multiple products and services for the AEC industry and has become a leading cad solutions provider in North America.
We provide 2D and 3D CAD drawings, CAD modeling, Millwork shop drawings, Architectural drafting, Construction drawings, Tile shop drawings, Fabrication shop drawings, and CAD conversion services and solutions for a wide range of industries. Our computer rendering services create solutions to resolve design issues, provide marketing strategies for investors and developers for both interior views and exterior perspectives. 
BluEntCAD has successful strategic partnerships with major builders and construction firms operating in diverse fields including urban development, residential, commercial, retail, hospitality, business and facility management services.
We have created efficient processes so that our clients can easily get value for money. Contact us to get samples and quotes!","Architecture and Planning","51-200 employees",,"Houston, Texas","United States","bluentcad.com","https://www.linkedin.com/company/bluentcad","People Search Updated"
,"GAL INTERIORS","GAL INTERIORS","Architecture and Planning","51-200 employees","Privately Held","FL, Florida","United States","galinteriors.com","https://www.linkedin.com/company/galinteriors","People Search Updated"
,"CG Visions","Provider of leading BIM consulting services for the building industry that allows companies to streamline their processes, integrate with the leading technology solutions, and utilize the BIM model in all aspects of their business. 

Our mission is to focus on accurate Building Information Modeling,
provide builders with the most information from BIM, integrate BIM information with leading technology solutions, leverage BIM in other aspects of your business model, and commitment to providing high level customer service, response time and client experience","Architecture and Planning","51-200 employees","Privately Held","Lafayette, Indiana","United States","cgvisions.com","https://www.linkedin.com/company/cg-visions","People Search Updated"
,"Customhome.ai","We make residential development, design & construction better for everyone involved. An @bimquotecorporation product.","Architecture and Planning","51-200 employees","Privately Held","Tacoma, WA","United States","customhome.ai","https://www.linkedin.com/company/customhome-ai","People Search Updated"
,"The Consulting Engineers Group-NM, P.C.","The Consulting Engineers Group-New Mexico, P.C. (CEG-NM) is a leader in the design and modeling of precast concrete structures such as stadiums, parking structures, schools, and industrial facilities.  CEG-NM was established in 2008 and is located in Albuquerque.

CEG-NM is one of four CEG subsidiary companies located in the United States. More than 120 CEG employees work in offices located in Albuquerque (NM), Mt. Prospect (IL), San Antonio (TX), and Longwood (FL). CEG Group, Inc. is an employee-owned (ESOP) company.

Visit our website to learn more:  www.cegengineers.com","Civil Engineering","51-200 employees","Privately Held","Albuquerque, New Mexico","United States","cegengineers.com","https://www.linkedin.com/company/the-consulting-engineers-group-nm-p-c","People Search Updated"
,"Enemon S.A. de C.V.","Somos la empresa mexicana líder en servicios especializados de Ingeniería, enfocados en la óptima ejecución de sus proyectos. Trabajamos bajo estándares de calidad nacionales e internacionales, ofreciendo a nuestros clientes la experiencia de especialistas en múltiples áreas, impulsando la realización y optimización de sus proyectos. 

Actualmente y dado la necesidad de nuestros clientes, hemos ampliado nuestro portafolio de servicios, convirténdonos en una empresa con soluciones integrales en las siguientes áreas:

-Servicios de Ingeniería para obra civil (arquitectura, estructuras y geotecnia)
-Supervisión de obra (infraestructura urbana)
-Inteligencia de mercados (geomarketing, análisis de mercados, geologística y levantamiento con dron)
-Sistema de Información Geográfica (consultoría y desarrollo)
-Enseñanza (cursos e-Learning)
-Contact Center
-BIM (próximamente)","Civil Engineering","51-200 employees","Privately Held","Ciudad de México, México","Mexico","enemon.com.mx","https://www.linkedin.com/company/enemon","People Search Updated"
,"LSI Corporation of America","In 1968 Lake Street Industries (LSI) opened its doors with a vision of providing premium quality laminate casework and storage systems to the commercial market.

Today LSI operates out of Plymouth, MN as the leading manufacturer and designer of laminate casework systems, solid surface and other interior products.

With a strong focus on meeting the needs of both architects and owners we have developed products for all disciplines in Commercial, Education, Healthcare, and Laboratory applications. LSI is the manufacturer most respected by Owners, the people who use our products every day. Architects and Contractors depend on us because we are committed to listening and creating innovative solutions that meet their needs.

LSI has delivered over 30,000 projects throughout the United States and internationally. No project is too large or too small for our experienced professional team and state-of-the-art fabrication facility.

We look forward to working with you on your next project.

AFFILIATIONS

Our products are of premium quality and consistently evolving to meet the needs of our customers.

LSI is a member of the Architectural Woodwork Institute and is certified under the AWI Quality Certification Program. Quality standard grade: Custom and Premium.

LSI is an AIA CES provider, offering several programs for architects and designers.

LSI is a Forest Stewardship Council supplier certified by the Rainforest Alliance. We understand the desire to furnish your facility with products manufactured using environmentally responsible materials and practices. As an FSC certified supplier, LSI products may contribute toward USGBC LEED credits.","Architecture and Planning","51-200 employees","Privately Held","Minneapolis, MN","United States","lsi-casework.com","https://www.linkedin.com/company/lsi-corporation-of-america","People Search Updated"
,"BIM Engineering & Construction","BIM E&C is a company that provides consulting and engineering services specialized in BIM and VDC.
Our services are focused on the evaluation, engineering, interference detection and compatibility, metering and modeling phases.

We have multidisciplinary staff of engineers and technical personnel specialized in processes, metal structures, mechanics, civil, architecture, sanitation, electrical, instrumentation, control and automation.

We cover:
• Pre-feasibility and feasibility studies
• Conceptual Engineering, Basic and Detail Engineering
• Detailed Engineering in EPC projects (engineering, procurement, construction), Fast Track modality
• Integration engineering with BIM Models in construction projects
• 3D laser scanning and Point Cloud processing
• Detailed engineering and Intelligent 3D Models
• Asset Information Models for Operation and Maintenance","Civil Engineering","201-500 employees","Self Owned","San Francisco","United States","bim-eyc.com","https://www.linkedin.com/company/bim-engineering-construction","People Search Updated"
,"CorbisStudio","Specializing in the creation of consumer & retail environments in both the US and International markets.  

We provide concept design & development along with project management.

Our team has experience in:
-Entertainment Design
-Mixed Use
-Tenant Improvement
-Multi-Use
-Showrooms","Architecture and Planning","51-200 employees","Privately Held","Los Angeles","United States","corbisstudio.com","https://www.linkedin.com/company/atmospheric-design-group","People Search Updated"
,"Miller & Associates Consulting Engineers, P.C.","Miller & Associates, Consulting Engineers, P.C., is a full-service consulting firm serving Nebraska and northern Kansas. Our firm provides clients with quality, dependable service by an experienced, professional staff. We have steadily grown to a firm of over 60 qualified and experienced engineers, architects, surveyors, GIS/CAD specialists, planners, grant writers, project management staff, and administrative personnel.","Civil Engineering","51-200 employees","Privately Held","Kearney, Nebraska","United States","miller-engineers.com","https://www.linkedin.com/company/miller-&-associates-consulting-engineers-p.c.","People Search Updated"
,"RDS TECHSERV PVT.LTD","RDS provides Computer Aided Drawing and Design services for AEC Industry. We are specialized in a wide range of CAD services, RDS utilizes the latest technology available today. Our team of Professional Engineers and CAD Technicians are committed to delivering the best Detailing and CAD services in the industry.","Civil Engineering","51-200 employees","Self Owned","Charlotte","United States","rdstechserv.com","https://www.linkedin.com/company/rdstechserv","People Search Updated"
,"CSJ Design Collaborative","CSJ Design Collaborative: Shaping the Future of Structural and Architectural Excellence
Welcome to CSJ Design Collaborative, a dynamic force in the realm of structural and architectural engineering. Established on the pillars of innovation, collaboration, and precision, CSJ stands as a beacon of excellence, dedicated to creating spaces that seamlessly blend aesthetics with functionality.

Our Vision
At CSJ, we envision a world where architectural marvels not only captivate the eye but also stand as testaments to sustainable and resilient design. Our vision extends beyond the conventional, pushing boundaries to shape environments that inspire and endure.","Architecture and Planning","51-200 employees","Privately Held","Hawaii","United States","csjdesigncollaborative.com","https://www.linkedin.com/company/csj-design-collaborative","People Search Updated"
,"FS Consulting LLC","FS Consulting is a Full Service Consulting firm specializing  in  architectural, engineering & facility management. We provide qualified Architects and Engineers for on-site project work. FS Consulting specialize in  REVIT, LEED, CAD & CAFM drafting, as-builds, CD, site surveys, 3-D modeling, rendering, and animation services.","Architecture and Planning","51-200 employees","Privately Held",,"United States","fscllc.net","https://www.linkedin.com/company/fs-consulting-llc","People Search Updated"
,"CPU PRIDE","Creative Production Union PRIDE was founded in 2013. The company handles a full line-up of services: concepts creation, urban development, building design, construction documentation,  cost-estimation, on site construction supervision.

We actively participate in competitions and cooperate with large international architectural companies, adapting their work to the Russian market and state regulations, advising during all stages of implementation.

One of the most important values for the company is use of building information modeling technologies - BIM. Performing complex tasks requires a comprehensive BIM solution that serves as an important tool for coordination of teamwork between architects, designers and engineers. BIM technology provides an integrated design solution during all stages of a building life cycle.","Architecture and Planning","51-200 employees","Privately Held","Moscow City","United States","prideproject.pro","https://www.linkedin.com/company/cpu-pride","People Search Updated"
,"Martineck Architects","MARTINECK Architects es una empresa con sede en la Ciudad de México, conformada por un equipo interdisciplinario de arquitectos y técnicos, que proveen servicios completos en los ámbitos de diseño de proyectos inmobiliarios llevando por prioridad la calidad en productos arquitectónicos, así como una gran especialidad en Project managment y Retail.

La fortaleza de MARTINECK Architects yace en su enfoque integral y especializado en la planeación rigurosa en cada edificio – independiente del tamaño, tipología o ubicación del proyecto. La colaboración cercana de arquitectos, ingenieros y nuestros clientes, que se extiende más allá del alcance y permite que MARTINECK Architects responda a los grandes retos de diseño y costos generando una planificación de cada proyecto en busca de la máxima eficiencia en todos los sectores del mismo.

Con este enfoque como premisa, la competitividad garantizada hace posible que la empresa brinde soluciones innovadoras a la medida de nuestros clientes.","Architecture and Planning","201-500 employees","Privately Held","Ciudad de México, Benito Juárez","Mexico","martineckarquitectos.com","https://www.linkedin.com/company/martineck-architects","People Search Updated"
,"American Concrete Industries","American Concrete Industries was formed in 1957 under the name of Maine Shawnee Step Company, Inc. by the Snowe brothers, Carleton, Richard & John.

In 1967 the company expanded from Auburn to Veazie, Maine and the corporate name was changed to its present name, American Concrete Industries.

Since 1957 American has been producing high quality pre-cast concrete products.  The company first started producing concrete steps and later moved into manufacturing burial vaults, septic tanks and commercial products.  American Concrete now employs over one hundred people and delivers pre-cast concrete products throughout Maine and northern New England.","Civil Engineering","51-200 employees","Privately Held","Veazie, Maine","United States","americanconcrete.com","https://www.linkedin.com/company/american-concrete-industries","People Search Updated"
,"Nexis Builds","Nexis Builds | Engineering the Future, Building with Excellence

At Nexis Builds, we’re more than just a civil engineering firm we’re innovators, problem-solvers, and builders of the future. As a Fortune 500 company, we specialize in cutting-edge engineering, construction, and infrastructure development, delivering sustainable and high-impact projects across multiple industries.  

Our Expertise  We provide full-spectrum civil engineering services, including:
 
Commercial & Residential Construction – High-rise buildings, urban developments, and modern housing solutions.  

Infrastructure & Transportation – Roads, bridges, highways, and transit systems designed for durability and efficiency.  Energy & Industrial Solutions – Power plants, manufacturing facilities, and large-scale industrial infrastructure.  

Smart & Sustainable Engineering – LEED-certified designs, green building solutions, and energy-efficient projects.  

Project Management & Consulting – Ensuring seamless execution, cost efficiency, and regulatory compliance. 
 
Why Choose Nexis Builds? 

Innovative Solutions: We integrate AI-driven modeling, BIM technology, and sustainable design to maximize efficiency. 

Client-Centric Approach: We prioritize transparency, collaboration, and value engineering to exceed expectations.  

Uncompromising Quality & Safety: Our projects adhere to the highest industry standards in safety and regulatory compliance.  

Industries We Serve Commercial & Residential | Infrastructure & Transportation | Energy & Utilities | Industrial & Manufacturing | Sustainable Development

At Nexis Builds, we’re shaping the future one project at a time. Follow us to stay updated on industry insights, innovations, and career opportunities.  

For business inquiries: info@nexisbuilds.com  
Website: https://nexisbuilds.com","Civil Engineering","51-200 employees","Privately Held","New Orleans, Louisiana","United States","nexisbuilds.com","https://www.linkedin.com/company/nexis-builds","People Search Updated"
